{
  "schema_version": "1.0.0",
  "grade": "V",
  "hours_per_week": 1,
  "year": "2025-2026",
  "modules": [
    {
      "module_index": 1,
      "module_theme_ro": "Calculatorul si organizarea datelor",
      "units": [
        {
          "unit_code": "V-M1-U01",
          "title_ro": "Norme de ergonomie si de siguranta",
          "hours_estimate": 1,
          "mapped_domains": [
            "Norme de ergonomie si de siguranta"
          ],
          "official_competency_targets": [],
          "lessons": [
            {
              "lesson_code": "V-M1-L01",
              "title_ro": "Norme de ergonomie si de siguranta",
              "path_lesson_json": "content/gimnaziu/V/m1/V-M1-L01.json",
              "path_quiz_json": "content/gimnaziu/V/m1/V-M1-L01.quiz.json",
              "estimated_minutes": 50
            }
          ],
          "assessments": {
            "diagnostic": [],
            "formative": [
              "Exit ticket",
              "Mini-quiz (R0)"
            ],
            "summative": []
          }
        },
        {
          "unit_code": "V-M1-U02",
          "title_ro": "Tipuri de sisteme de calcul si de comunicatii",
          "hours_estimate": 1,
          "mapped_domains": [
            "Tipuri de sisteme de calcul si de comunicatii"
          ],
          "official_competency_targets": [],
          "lessons": [
            {
              "lesson_code": "V-M1-L02",
              "title_ro": "Tipuri de sisteme de calcul si de comunicatii",
              "path_lesson_json": "content/gimnaziu/V/m1/V-M1-L02.json",
              "path_quiz_json": "content/gimnaziu/V/m1/V-M1-L02.quiz.json",
              "estimated_minutes": 50
            }
          ],
          "assessments": {
            "diagnostic": [],
            "formative": [
              "Exit ticket",
              "Mini-quiz (R0)"
            ],
            "summative": []
          }
        },
        {
          "unit_code": "V-M1-U03",
          "title_ro": "Elemente de arhitectura a unui sistem de calcul",
          "hours_estimate": 1,
          "mapped_domains": [
            "Elemente de arhitectura a unui sistem de calcul"
          ],
          "official_competency_targets": [],
          "lessons": [
            {
              "lesson_code": "V-M1-L03",
              "title_ro": "Elemente de arhitectura a unui sistem de calcul",
              "path_lesson_json": "content/gimnaziu/V/m1/V-M1-L03.json",
              "path_quiz_json": "content/gimnaziu/V/m1/V-M1-L03.quiz.json",
              "estimated_minutes": 50
            }
          ],
          "assessments": {
            "diagnostic": [],
            "formative": [
              "Exit ticket",
              "Mini-quiz (R0)"
            ],
            "summative": []
          }
        },
        {
          "unit_code": "V-M1-U04",
          "title_ro": "Sisteme de operare",
          "hours_estimate": 1,
          "mapped_domains": [
            "Sisteme de operare"
          ],
          "official_competency_targets": [],
          "lessons": [
            {
              "lesson_code": "V-M1-L04",
              "title_ro": "Sisteme de operare",
              "path_lesson_json": "content/gimnaziu/V/m1/V-M1-L04.json",
              "path_quiz_json": "content/gimnaziu/V/m1/V-M1-L04.quiz.json",
              "estimated_minutes": 50
            }
          ],
          "assessments": {
            "diagnostic": [],
            "formative": [
              "Exit ticket",
              "Mini-quiz (R0)"
            ],
            "summative": []
          }
        }
      ],
      "spaced_retrieval_plan": {
        "R0": [
          "Exit ticket la fiecare lectie"
        ],
        "R1": [
          "Recapitulare scurta saptamana urmatoare"
        ],
        "R2": [
          "Mini-debug/mini-task dupa 3 saptamani"
        ]
      },
      "teacher_notes": {
        "integration_notes": [],
        "differentiation": {
          "support": [
            "Lucru ghidat + sabloane"
          ],
          "stretch": [
            "Extension tasks / mini-proiecte"
          ]
        }
      }
    },
    {
      "module_index": 2,
      "module_theme_ro": "Internet si siguranta digitala",
      "units": [
        {
          "unit_code": "V-M2-U01",
          "title_ro": "Internet",
          "hours_estimate": 1,
          "mapped_domains": [
            "Internet"
          ],
          "official_competency_targets": [],
          "lessons": [
            {
              "lesson_code": "V-M2-L01",
              "title_ro": "Internet",
              "path_lesson_json": "content/gimnaziu/V/m2/V-M2-L01.json",
              "path_quiz_json": "content/gimnaziu/V/m2/V-M2-L01.quiz.json",
              "estimated_minutes": 50
            }
          ],
          "assessments": {
            "diagnostic": [],
            "formative": [
              "Exit ticket",
              "Mini-quiz (R0)"
            ],
            "summative": []
          }
        }
      ],
      "spaced_retrieval_plan": {
        "R0": [
          "Exit ticket la fiecare lectie"
        ],
        "R1": [
          "Recapitulare scurta saptamana urmatoare"
        ],
        "R2": [
          "Mini-debug/mini-task dupa 3 saptamani"
        ]
      },
      "teacher_notes": {
        "integration_notes": [],
        "differentiation": {
          "support": [
            "Lucru ghidat + sabloane"
          ],
          "stretch": [
            "Extension tasks / mini-proiecte"
          ]
        }
      }
    },
    {
      "module_index": 3,
      "module_theme_ro": "Editare grafica",
      "units": [
        {
          "unit_code": "V-M3-U01",
          "title_ro": "Editoare grafice",
          "hours_estimate": 1,
          "mapped_domains": [
            "Editoare grafice"
          ],
          "official_competency_targets": [],
          "lessons": [
            {
              "lesson_code": "V-M3-L01",
              "title_ro": "Editoare grafice",
              "path_lesson_json": "content/gimnaziu/V/m3/V-M3-L01.json",
              "path_quiz_json": "content/gimnaziu/V/m3/V-M3-L01.quiz.json",
              "estimated_minutes": 50
            }
          ],
          "assessments": {
            "diagnostic": [],
            "formative": [
              "Exit ticket",
              "Mini-quiz (R0)"
            ],
            "summative": []
          }
        }
      ],
      "spaced_retrieval_plan": {
        "R0": [
          "Exit ticket la fiecare lectie"
        ],
        "R1": [
          "Recapitulare scurta saptamana urmatoare"
        ],
        "R2": [
          "Mini-debug/mini-task dupa 3 saptamani"
        ]
      },
      "teacher_notes": {
        "integration_notes": [],
        "differentiation": {
          "support": [
            "Lucru ghidat + sabloane"
          ],
          "stretch": [
            "Extension tasks / mini-proiecte"
          ]
        }
      }
    },
    {
      "module_index": 4,
      "module_theme_ro": "Algoritmi: secventa si decizie",
      "units": [
        {
          "unit_code": "V-M4-U01",
          "title_ro": "Algoritmi (introducere) & structuri de control",
          "hours_estimate": 1,
          "mapped_domains": [
            "Algoritmi (introducere) & structuri de control"
          ],
          "official_competency_targets": [],
          "lessons": [
            {
              "lesson_code": "V-M4-L01",
              "title_ro": "Algoritmi (introducere) & structuri de control",
              "path_lesson_json": "content/gimnaziu/V/m4/V-M4-L01.json",
              "path_quiz_json": "content/gimnaziu/V/m4/V-M4-L01.quiz.json",
              "estimated_minutes": 50
            }
          ],
          "assessments": {
            "diagnostic": [],
            "formative": [
              "Exit ticket",
              "Mini-quiz (R0)"
            ],
            "summative": []
          }
        }
      ],
      "spaced_retrieval_plan": {
        "R0": [
          "Exit ticket la fiecare lectie"
        ],
        "R1": [
          "Recapitulare scurta saptamana urmatoare"
        ],
        "R2": [
          "Mini-debug/mini-task dupa 3 saptamani"
        ]
      },
      "teacher_notes": {
        "integration_notes": [],
        "differentiation": {
          "support": [
            "Lucru ghidat + sabloane"
          ],
          "stretch": [
            "Extension tasks / mini-proiecte"
          ]
        }
      }
    },
    {
      "module_index": 5,
      "module_theme_ro": "Proiect si evaluare",
      "units": [
        {
          "unit_code": "V-M5-U01",
          "title_ro": "Placeholder (de completat)",
          "hours_estimate": 1,
          "mapped_domains": [
            "TBD"
          ],
          "official_competency_targets": [],
          "lessons": [
            {
              "lesson_code": "V-M5-L01",
              "title_ro": "Placeholder lesson",
              "path_lesson_json": "TBD",
              "path_quiz_json": "TBD",
              "estimated_minutes": 50
            }
          ],
          "assessments": {
            "diagnostic": [],
            "formative": [],
            "summative": []
          }
        }
      ],
      "spaced_retrieval_plan": {
        "R0": [
          "Exit ticket la fiecare lectie"
        ],
        "R1": [
          "Recapitulare scurta saptamana urmatoare"
        ],
        "R2": [
          "Mini-debug/mini-task dupa 3 saptamani"
        ]
      },
      "teacher_notes": {
        "integration_notes": [],
        "differentiation": {
          "support": [
            "Lucru ghidat + sabloane"
          ],
          "stretch": [
            "Extension tasks / mini-proiecte"
          ]
        }
      }
    }
  ],
  "x_metadata": {
    "generated_at": "2026-01-16T15:49:40",
    "generator": "tools/generate_content.py"
  }
}