{
  "schema_version": "1.0.0",
  "grade": "VII",
  "hours_per_week": 1,
  "year": "2025-2026",
  "modules": [
    {
      "module_index": 1,
      "module_theme_ro": "Procesare de text",
      "units": [
        {
          "unit_code": "VII-M1-U01",
          "title_ro": "Editor de texte",
          "hours_estimate": 1,
          "mapped_domains": [
            "Editor de texte"
          ],
          "official_competency_targets": [],
          "lessons": [
            {
              "lesson_code": "VII-M1-L01",
              "title_ro": "Editor de texte",
              "path_lesson_json": "content/gimnaziu/VII/m1/VII-M1-L01.json",
              "path_quiz_json": "content/gimnaziu/VII/m1/VII-M1-L01.quiz.json",
              "estimated_minutes": 50
            }
          ],
          "assessments": {
            "diagnostic": [],
            "formative": [
              "Exit ticket",
              "Mini-quiz (R0)"
            ],
            "summative": []
          }
        }
      ],
      "spaced_retrieval_plan": {
        "R0": [
          "Exit ticket la fiecare lectie"
        ],
        "R1": [
          "Recapitulare scurta saptamana urmatoare"
        ],
        "R2": [
          "Mini-debug/mini-task dupa 3 saptamani"
        ]
      },
      "teacher_notes": {
        "integration_notes": [],
        "differentiation": {
          "support": [
            "Lucru ghidat + sabloane"
          ],
          "stretch": [
            "Extension tasks / mini-proiecte"
          ]
        }
      }
    },
    {
      "module_index": 2,
      "module_theme_ro": "Editare audio-video",
      "units": [
        {
          "unit_code": "VII-M2-U01",
          "title_ro": "Aplicatii audio / audio-video",
          "hours_estimate": 1,
          "mapped_domains": [
            "Aplicatii audio / audio-video"
          ],
          "official_competency_targets": [],
          "lessons": [
            {
              "lesson_code": "VII-M2-L01",
              "title_ro": "Aplicatii audio / audio-video",
              "path_lesson_json": "content/gimnaziu/VII/m2/VII-M2-L01.json",
              "path_quiz_json": "content/gimnaziu/VII/m2/VII-M2-L01.quiz.json",
              "estimated_minutes": 50
            }
          ],
          "assessments": {
            "diagnostic": [],
            "formative": [
              "Exit ticket",
              "Mini-quiz (R0)"
            ],
            "summative": []
          }
        }
      ],
      "spaced_retrieval_plan": {
        "R0": [
          "Exit ticket la fiecare lectie"
        ],
        "R1": [
          "Recapitulare scurta saptamana urmatoare"
        ],
        "R2": [
          "Mini-debug/mini-task dupa 3 saptamani"
        ]
      },
      "teacher_notes": {
        "integration_notes": [],
        "differentiation": {
          "support": [
            "Lucru ghidat + sabloane"
          ],
          "stretch": [
            "Extension tasks / mini-proiecte"
          ]
        }
      }
    },
    {
      "module_index": 3,
      "module_theme_ro": "Programare textuala",
      "units": [
        {
          "unit_code": "VII-M3-U01",
          "title_ro": "Limbaj de programare (introducere)",
          "hours_estimate": 1,
          "mapped_domains": [
            "Limbaj de programare (introducere)"
          ],
          "official_competency_targets": [],
          "lessons": [
            {
              "lesson_code": "VII-M3-L01",
              "title_ro": "Limbaj de programare (introducere)",
              "path_lesson_json": "content/gimnaziu/VII/m3/VII-M3-L01.json",
              "path_quiz_json": "content/gimnaziu/VII/m3/VII-M3-L01.quiz.json",
              "estimated_minutes": 50
            }
          ],
          "assessments": {
            "diagnostic": [],
            "formative": [
              "Exit ticket",
              "Mini-quiz (R0)"
            ],
            "summative": []
          }
        }
      ],
      "spaced_retrieval_plan": {
        "R0": [
          "Exit ticket la fiecare lectie"
        ],
        "R1": [
          "Recapitulare scurta saptamana urmatoare"
        ],
        "R2": [
          "Mini-debug/mini-task dupa 3 saptamani"
        ]
      },
      "teacher_notes": {
        "integration_notes": [],
        "differentiation": {
          "support": [
            "Lucru ghidat + sabloane"
          ],
          "stretch": [
            "Extension tasks / mini-proiecte"
          ]
        }
      }
    },
    {
      "module_index": 4,
      "module_theme_ro": "Colaborare online",
      "units": [
        {
          "unit_code": "VII-M4-U01",
          "title_ro": "Aplicatii colaborative",
          "hours_estimate": 1,
          "mapped_domains": [
            "Aplicatii colaborative"
          ],
          "official_competency_targets": [],
          "lessons": [
            {
              "lesson_code": "VII-M4-L01",
              "title_ro": "Aplicatii colaborative",
              "path_lesson_json": "content/gimnaziu/VII/m4/VII-M4-L01.json",
              "path_quiz_json": "content/gimnaziu/VII/m4/VII-M4-L01.quiz.json",
              "estimated_minutes": 50
            }
          ],
          "assessments": {
            "diagnostic": [],
            "formative": [
              "Exit ticket",
              "Mini-quiz (R0)"
            ],
            "summative": []
          }
        }
      ],
      "spaced_retrieval_plan": {
        "R0": [
          "Exit ticket la fiecare lectie"
        ],
        "R1": [
          "Recapitulare scurta saptamana urmatoare"
        ],
        "R2": [
          "Mini-debug/mini-task dupa 3 saptamani"
        ]
      },
      "teacher_notes": {
        "integration_notes": [],
        "differentiation": {
          "support": [
            "Lucru ghidat + sabloane"
          ],
          "stretch": [
            "Extension tasks / mini-proiecte"
          ]
        }
      }
    },
    {
      "module_index": 5,
      "module_theme_ro": "Proiect final",
      "units": [
        {
          "unit_code": "VII-M5-U01",
          "title_ro": "Placeholder (de completat)",
          "hours_estimate": 1,
          "mapped_domains": [
            "TBD"
          ],
          "official_competency_targets": [],
          "lessons": [
            {
              "lesson_code": "VII-M5-L01",
              "title_ro": "Placeholder lesson",
              "path_lesson_json": "TBD",
              "path_quiz_json": "TBD",
              "estimated_minutes": 50
            }
          ],
          "assessments": {
            "diagnostic": [],
            "formative": [],
            "summative": []
          }
        }
      ],
      "spaced_retrieval_plan": {
        "R0": [
          "Exit ticket la fiecare lectie"
        ],
        "R1": [
          "Recapitulare scurta saptamana urmatoare"
        ],
        "R2": [
          "Mini-debug/mini-task dupa 3 saptamani"
        ]
      },
      "teacher_notes": {
        "integration_notes": [],
        "differentiation": {
          "support": [
            "Lucru ghidat + sabloane"
          ],
          "stretch": [
            "Extension tasks / mini-proiecte"
          ]
        }
      }
    }
  ],
  "x_metadata": {
    "generated_at": "2026-01-16T15:49:40",
    "generator": "tools/generate_content.py"
  }
}