{
  "schema_version": "1.0.0",
  "grade": "VI",
  "hours_per_week": 1,
  "year": "2025-2026",
  "modules": [
    {
      "module_index": 1,
      "module_theme_ro": "Prezentari multimedia",
      "units": [
        {
          "unit_code": "VI-M1-U01",
          "title_ro": "Prezentari",
          "hours_estimate": 1,
          "mapped_domains": [
            "Prezentari"
          ],
          "official_competency_targets": [],
          "lessons": [
            {
              "lesson_code": "VI-M1-L01",
              "title_ro": "Prezentari",
              "path_lesson_json": "content/gimnaziu/VI/m1/VI-M1-L01.json",
              "path_quiz_json": "content/gimnaziu/VI/m1/VI-M1-L01.quiz.json",
              "estimated_minutes": 50
            }
          ],
          "assessments": {
            "diagnostic": [],
            "formative": [
              "Exit ticket",
              "Mini-quiz (R0)"
            ],
            "summative": []
          }
        }
      ],
      "spaced_retrieval_plan": {
        "R0": [
          "Exit ticket la fiecare lectie"
        ],
        "R1": [
          "Recapitulare scurta saptamana urmatoare"
        ],
        "R2": [
          "Mini-debug/mini-task dupa 3 saptamani"
        ]
      },
      "teacher_notes": {
        "integration_notes": [],
        "differentiation": {
          "support": [
            "Lucru ghidat + sabloane"
          ],
          "stretch": [
            "Extension tasks / mini-proiecte"
          ]
        }
      }
    },
    {
      "module_index": 2,
      "module_theme_ro": "Animatii grafice",
      "units": [
        {
          "unit_code": "VI-M2-U01",
          "title_ro": "Animatii grafice",
          "hours_estimate": 1,
          "mapped_domains": [
            "Animatii grafice"
          ],
          "official_competency_targets": [],
          "lessons": [
            {
              "lesson_code": "VI-M2-L01",
              "title_ro": "Animatii grafice",
              "path_lesson_json": "content/gimnaziu/VI/m2/VI-M2-L01.json",
              "path_quiz_json": "content/gimnaziu/VI/m2/VI-M2-L01.quiz.json",
              "estimated_minutes": 50
            }
          ],
          "assessments": {
            "diagnostic": [],
            "formative": [
              "Exit ticket",
              "Mini-quiz (R0)"
            ],
            "summative": []
          }
        }
      ],
      "spaced_retrieval_plan": {
        "R0": [
          "Exit ticket la fiecare lectie"
        ],
        "R1": [
          "Recapitulare scurta saptamana urmatoare"
        ],
        "R2": [
          "Mini-debug/mini-task dupa 3 saptamani"
        ]
      },
      "teacher_notes": {
        "integration_notes": [],
        "differentiation": {
          "support": [
            "Lucru ghidat + sabloane"
          ],
          "stretch": [
            "Extension tasks / mini-proiecte"
          ]
        }
      }
    },
    {
      "module_index": 3,
      "module_theme_ro": "Algoritmi: structuri repetitive",
      "units": [
        {
          "unit_code": "VI-M3-U01",
          "title_ro": "Algoritmi (structuri repetitive) + reprezentare",
          "hours_estimate": 1,
          "mapped_domains": [
            "Algoritmi (structuri repetitive) + reprezentare"
          ],
          "official_competency_targets": [],
          "lessons": [
            {
              "lesson_code": "VI-M3-L01",
              "title_ro": "Algoritmi (structuri repetitive) + reprezentare",
              "path_lesson_json": "content/gimnaziu/VI/m3/VI-M3-L01.json",
              "path_quiz_json": "content/gimnaziu/VI/m3/VI-M3-L01.quiz.json",
              "estimated_minutes": 50
            }
          ],
          "assessments": {
            "diagnostic": [],
            "formative": [
              "Exit ticket",
              "Mini-quiz (R0)"
            ],
            "summative": []
          }
        }
      ],
      "spaced_retrieval_plan": {
        "R0": [
          "Exit ticket la fiecare lectie"
        ],
        "R1": [
          "Recapitulare scurta saptamana urmatoare"
        ],
        "R2": [
          "Mini-debug/mini-task dupa 3 saptamani"
        ]
      },
      "teacher_notes": {
        "integration_notes": [],
        "differentiation": {
          "support": [
            "Lucru ghidat + sabloane"
          ],
          "stretch": [
            "Extension tasks / mini-proiecte"
          ]
        }
      }
    },
    {
      "module_index": 4,
      "module_theme_ro": "Comunicare online",
      "units": [
        {
          "unit_code": "VI-M4-U01",
          "title_ro": "Comunicare prin Internet",
          "hours_estimate": 1,
          "mapped_domains": [
            "Comunicare prin Internet"
          ],
          "official_competency_targets": [],
          "lessons": [
            {
              "lesson_code": "VI-M4-L01",
              "title_ro": "Comunicare prin Internet",
              "path_lesson_json": "content/gimnaziu/VI/m4/VI-M4-L01.json",
              "path_quiz_json": "content/gimnaziu/VI/m4/VI-M4-L01.quiz.json",
              "estimated_minutes": 50
            }
          ],
          "assessments": {
            "diagnostic": [],
            "formative": [
              "Exit ticket",
              "Mini-quiz (R0)"
            ],
            "summative": []
          }
        }
      ],
      "spaced_retrieval_plan": {
        "R0": [
          "Exit ticket la fiecare lectie"
        ],
        "R1": [
          "Recapitulare scurta saptamana urmatoare"
        ],
        "R2": [
          "Mini-debug/mini-task dupa 3 saptamani"
        ]
      },
      "teacher_notes": {
        "integration_notes": [],
        "differentiation": {
          "support": [
            "Lucru ghidat + sabloane"
          ],
          "stretch": [
            "Extension tasks / mini-proiecte"
          ]
        }
      }
    },
    {
      "module_index": 5,
      "module_theme_ro": "Proiect integrat",
      "units": [
        {
          "unit_code": "VI-M5-U01",
          "title_ro": "Placeholder (de completat)",
          "hours_estimate": 1,
          "mapped_domains": [
            "TBD"
          ],
          "official_competency_targets": [],
          "lessons": [
            {
              "lesson_code": "VI-M5-L01",
              "title_ro": "Placeholder lesson",
              "path_lesson_json": "TBD",
              "path_quiz_json": "TBD",
              "estimated_minutes": 50
            }
          ],
          "assessments": {
            "diagnostic": [],
            "formative": [],
            "summative": []
          }
        }
      ],
      "spaced_retrieval_plan": {
        "R0": [
          "Exit ticket la fiecare lectie"
        ],
        "R1": [
          "Recapitulare scurta saptamana urmatoare"
        ],
        "R2": [
          "Mini-debug/mini-task dupa 3 saptamani"
        ]
      },
      "teacher_notes": {
        "integration_notes": [],
        "differentiation": {
          "support": [
            "Lucru ghidat + sabloane"
          ],
          "stretch": [
            "Extension tasks / mini-proiecte"
          ]
        }
      }
    }
  ],
  "x_metadata": {
    "generated_at": "2026-01-16T15:49:40",
    "generator": "tools/generate_content.py"
  }
}